id,name,description,category,url,frameworks,languages,features,integrations,maturityScore,popularityScore,pricing,notes
"81f7db24-6dd7-4de0-bcde-0012d7e6a6c0","Plasmic","Visual builder for React applications with code export.","Frontend/Design","https://www.plasmic.app","React;Next.js;Gatsby","JavaScript;TypeScript","Visual editing;code sync;CMS;component marketplace","React;Next.js;Gatsby;Figma","8.5","8","Free tier, Team $28/user/month","Bridge between design and code, developer-friendly"
"6a53827a-0b28-4cb5-832a-0257cbdbc7a8","Builder.io","Visual development platform for creating digital experiences.","Frontend/Design","https://www.builder.io","React;Vue;Angular;Next.js","JavaScript;TypeScript","Visual CMS;A/B testing;personalization;headless architecture","Shopify;React;Vue;Angular","9","8.5","Free tier, Growth $99/month","Enterprise-grade, excellent for marketing teams"
"aa9d89f3-4f48-45e5-91cc-ec1a0ea2b7f8","Retool","Low-code platform for building internal tools quickly.","Frontend/Design","https://retool.com","JavaScript;SQL","JavaScript;SQL;Python","Drag-drop UI;database connectors;API integrations;custom code","PostgreSQL;MySQL;MongoDB;REST APIs","9","9","Free tier, Team $10/user/month","Industry standard for internal tools"
"a2433c22-f4b4-4897-abc1-e2f294c66b7b","Appsmith","Open-source low-code platform for building internal apps.","Frontend/Design","https://www.appsmith.com","JavaScript","JavaScript;SQL","Visual builder;database integration;REST/GraphQL;Git sync","PostgreSQL;MongoDB;REST APIs;GraphQL","8","8.2","Free self-hosted, Cloud from $0","Open-source Retool alternative"
"5e98bf53-b426-4a36-b5b8-47fd209fda78","Directus","Open-source data platform for headless CMS and API.","Backend/Database","https://directus.io","Node.js;Vue.js","JavaScript;TypeScript","Headless CMS;REST/GraphQL API;data studio;workflows","PostgreSQL;MySQL;SQLite;MongoDB","8.5","8","Free self-hosted, Cloud from $15/month","Database-first approach, very flexible"
"d050fe57-39dc-4ae6-a8aa-e2e88e8ab375","Strapi","Open-source headless CMS for building APIs quickly.","Backend/Database","https://strapi.io","Node.js;React","JavaScript;TypeScript","Content types builder;REST/GraphQL;media library;i18n","PostgreSQL;MySQL;SQLite;MongoDB","9","9.2","Free self-hosted, Cloud from $99/month","Most popular open-source headless CMS"
"0aa3d8d4-b4c3-4c64-8da6-b09299efe196","Hygraph","GraphQL-native headless CMS with content federation.","Backend/Database","https://hygraph.com","GraphQL","All via GraphQL","GraphQL API;content federation;webhooks;localization","Next.js;Gatsby;Remix;Vercel","8.5","7.8","Free tier, Pro from $299/month","Formerly GraphCMS, excellent for GraphQL projects"
"4d696573-a1c4-4b09-ac81-2be32e2d6117","Convex","Backend platform with real-time sync and serverless functions.","Backend/Database","https://www.convex.dev","React;Next.js;Vue","TypeScript;JavaScript","Real-time sync;serverless functions;ACID transactions;type safety","React;Next.js;Clerk;Auth0","7.5","7","Free tier, Pro $25/month","Modern Firebase alternative with better DX"
